109,23,1,0,1,1,1,3,6,4,7,6,3,7,"Successful, but it was difficult to make smooth marks.",1,0,"I feel like it goes beyond psychomotoric coordination. My guess it the purpose is to see if people will cheat/are able to hold the pen correctly, though they are unsupervised. ",20,1,1,Biology Pre-med 
110,24,0,1,1,1,1,4,3,5,2,6,4,4,"Good, teeth never touched the pen.",1,0,This might be used to help people write that either have no hands or do not have the ability to grasp a writing utensil. It could also be used just to see how well we can use other body parts that we usually wouldn't use to complete a test. ,19,1,1,Psychology 
111,40087,1,1,0,1,1,3,9,8,2,7,1,7,Somewhat successful,1,0,No idea,19,0,1,Psychology 
112,39811,0,1,0,1,1,3,9,9,3,5,2,6,Successful but everything looks like chicken scratch,0,0,"To discover how hard, but possible it is to complete simple tasks like writing with things other than your hands like some disabled people have to do.",19,0,1,Nursing
113,25,1,1,1,1,1,4,9,9,5,7,3,4,Somewhat successful,1,0,This experiment may be to look at how well people can follow directions and ignore problems like the saliva dripping from their mouth.,23,0,1,Clinical lab science/ Dialysis Tech.
114,40507,0,1,1,1,1,4,6,7,7,6,1,2,8,1,0,Comprehension and retention of information when distracted by task that is difficult or different.,21,0,1,Psychology/Sociology 
115,40288,1,0,1,1,0,2,6,7,0,0,1,3,Not very,1,0,Not being able to use one's hands creates a stressful situation. Humorous materials were used as stimuli to test if it would reduce stress or anxiety in that situation. Does comedy reduce irritability to stressful situations or make the situation seem less difficult making it easier to cope with.,21,0,1,Psychology/Sociology 
116,40546,0,0,1,0,1,2,6,2,5,3,2,1,It was difficult.,1,0,To see how quickly our brains pick up on using body parts (mouth) when we aren't able to use our hands and how well we can multi-task. Holding pen in mouth and reading cartoons.,20,0,1,Exercise Science (Pre-PT)
117,40234,1,0,0,0,0,0,9,9,8,3,0,1,Awful,1,0,I think it had to do with anxiety levels. I felt high anxiety trying to circle things while holding the pen in my mouth. Reading the cartoons was suppose to make you laugh which then was suppose to lower anxiety level. ,20,0,1,Psychology 
118,40435,0,1,1,1,1,4,8,9,0,9,6,9,Found myself trying to grasp with my teeth but was unsuccessful.,1,0,To try and see if the first couple of tasks would frustrate me and I would find the cartoons less amusing. ,20,0,1,Psychology/Pre OT
119,39826,1,1,1,1,1,4,8,6,2,5,2,4,Pretty successful.,1,0,To see whether or not using a different body part to use an object affects a person's ability to understand the task.,19,1,1,Pre-OT
120,26,0,1,1,1,1,4,6,5,2,5,5,2,It was difficult to hold the pen without my teeth.,1,0,"Studying the impact of alternative forms of writing - some people cannot use their hands to write, does the concentration required to hold a utensil affect the understanding of what they read?",21,0,1,Bio/Pre-Med Major
121,40552,1,1,1,1,1,4,4,2,2,8,0,9,it was hard top hold it it in the correct position,1,0,The purpose is something that I literally have no idea about.,20,0,1,Bio/Pre-Med Major
122,40597,0,1,1,1,1,4,4,5,3,2,3,3,pretty sucessful,1,0,To study psychomtoric coordination which is people's ability to perform task with parts the body they normally wouldn't use.,19,0,1,Bio/Pre PT
123,40339,1,0,1,0,1,2,4,5,6,3,6,6,"not very,it was hard for me",1,0,Following instructions while trying to complete a difficult taks.,20,0,1,Community/Clinical psychology
124,27,1,1,1,1,1,4,4,6,2,4,4,7,I think I did good,0,0,To see our psychomotor abilities using parts of our body we would normally never use for tasks such as writing or holding a pen,22,0,1,psychology
125,28,0,1,1,1,1,4,9,5,9,9,7,9,blank,1,0,to see how easy it is for disabled individuals to learn how to write without using their hands,21,0,1,Bio pre physical therapy
126,29,1,1,1,1,1,4,4,1,2,6,0,4,90%? Had some difficulty at some points,1,0,to see how many people actually followed the instructions and succeeded. ,19,0,1,Bio pre med
127,30,0,1,1,1,1,4,7,4,0,0,0,3,limited,0,0,fine vs. gross motor skills coordination,21,0,1,"International relations, Soc/Criminal justice"
128,31,1,1,1,1,1,4,5,6,1,7,1,8,sort of,1,0,to see if our brain still works the sme doing tasks we aren't used to doing.,21,0,1,psychology
129,32,0,1,1,0,0,2,5,7,5,7,2,5,blank,1,1,"the muscles we use to hold the pen are the same muscles we use to show emotion - (happy, sad, etc)",21,0,1,pre-OT
130,33,1,1,1,1,1,4,9,6,7,8,8,7,I slipped up a couple times but I think I did pretty well overall,1,0,looking at how we think how our brains function while trying to perform a task that is very foreign to us,21,0,1,Bio pre med
131,34,0,1,1,1,1,4,1,3,2,6,3,4,it was pretty easy,1,0,to test the effectiveness of using only your mouth to write.,22,0,1,History
132,40330,1,0,0,0,0,0,9,5,5,1,4,4,not very,1,0,how easy / hard it is to writing in non convenient ways and how it would affect aq person on a day to day basis considering laughing commonly occurs.,20,0,1,psych pre OT
133,39577,0,1,0,1,1,3,5,4,0,5,5,7,not too successful but better than I thought,1,0,"to do the right thing when nobody is looking, even though everyone is watching you",19,0,1,communications
134,35,1,1,1,1,1,4,7,5,0,3,1,8,"semi successful, I caought myself wanting to put my lips around the marker.",1,0,"the purpose of this experiment is was to observe how people would react (facial expressions, hands moving, actually following the instructions) when put in a situation in which is foreign to them (i.e. writing by holding a pen in their teeth)",18,0,1,psychology PT
135,40165,0,1,1,1,1,4,8,4,1,5,7,7,I think I was very successful in holding it and keeping it in the right position.,1,0,to perform normal tasks with a pen but with another part of our body. ,18,0,1,Early Childhood Intervention Specialist
136,36,1,1,1,1,1,4,7,5,6,6,2,8,I believe it was a success!,1,0,"measure response physiologically with correct technique by way of connecting dots, underlining, and amusement of cartoons.",21,1,1,Bio pre PT
137,37,0,1,1,1,1,4,9,9,9,9,9,9,my face hurt. The sharpie kept slipping. ,1,0,we think that other people's pain or mild discomfort is amusing when we are also in pain or mildly uncomfrtable,21,0,1,corporate communications
138,40333,0,1,1,1,1,4,6,3,7,6,6,9,I feel like I did a pretty decent job,1,0,to practice writing using a different part of your body than normal.,20,0,1,psych pre OT
139,38,0,1,1,1,1,4,8,7, , , , ,not very successful,1,0,I have no idea!,21,0,1,bio pre dentistry
140,39,1,1,1,1,1,4,5,1,4,8,9,9,very successful,1,0,to see how others that don't have capabilities of their hands can still do the tasks that we can even though they don't have the same capabilities as us. It also shows that they can have the same cognitive and comical abilities as us even though they may not have all of the same capabilities.,21,0,1,education
141,40,1,1,1,1,1,4,6,2,9,5,1,7,I was able to do it but it was hard to keep it like that,0,0,Find amusement in watching people struggle to write with pens in their mouths.,19,0,1,Bio pre PT
142,41,1,1,1,1,1,4,5,1,3,5,6,6,"not very successful at first, but it got easier as the experiment went along",1,0,I honestly have no idea but I thought the comics got funnier as the experiment progressed.,19,0,1,exercise science
143,42,0,0,0,0,0,0,7,5,2,8,2,5,semi-successful  ,1,0,to see if one would follow the directions about holding the pen,21,0,1,psychology
144,43,1,1,1,1,1,4,7,2,5,7,5,9,partially successful,1,0,to better understand how people with physical disabilities have to struggle with simple tasks such as using a pen,20,0,1,pre med
145,44,0,1,1,1,1,4,4,4,3,4,5,3,pretty successful but it was difficult,1,0,to determine the difficulty of basic tasks suchas writing for those who have nothing that affects this ability compared to those who have.,20,0,1,nursing
146,45,1,1,1,1,1,4,3,1,4,1,3,5,fairly successful ,1,0,to see the effectiveness of using a pen in a way it's not normally used and test the brain activity when you're trying to concentrate on the pen.,19,1,1,finance
147,40345,0,0,0,0,0,0,6,4,5,6,3,4,semi-successful,1,0,to gauge efficiency and usefulness of non tradityional therapy solutions for those with physical disabilities,20,1,1,psychology
148,46,1,1,1,1,1,4,7,6,6,8,6,8,I think my lips touched in the beginning but then I corrected them,1,1,I think it was to determine if having the pen in the mouth (forcing you to smile) made the cartoons funnier.,21,0,1,international relations 
149,48,0,0,0,0,0,0,4,5,6,7,4,5,very,1,0,to see how well parts of your body can adapt to doing the same motor skills as other parts of your body,19,0,1,psych pre OT
150,49,1,1,1,1,1,4,6,4,6,7,4,8,semi successful ,1,0,"to see if presented w/various tasks, if you would still follow instructions the entire time (hold the pen right in your mouth). Also to see what time of actions caused a slipup in holding the pen.",20,0,1,Bio pre pt
151,48,0,1,1,1,1,4,9,8,0,7,1,1,successful,1,0,to test peoples ability to perform various tasks w a part of their body they would not normally use -- probably also to follow instructions,20,0,1,corporate comm 
152,50,1,1,1,1,1,4,8,5,3,5,4,6,I salivated a lot… my lips hit the pen a couple of times. ,1,0,possibly about how an uncomfortable task can make you not focus on other details such as the cartoons message. This could be a similarty to what people with impairments experience. ,21,0,1,nursing
,,,,,,,,,,,,,,,,,,19.52317881,,,
